Title,Author,CallNo,AccNo,
Elementary engineering mathematics,"Grewal, B.S.",510 GRE,185969,
Elementary linear algebra,"Anton, Howard",512.5 ANT,229154,
Elementary linear algebra,"Andrilli, Stephen",512.5 AND,267303,
Elementary psychology,"Gates, Arthur I",150.19 GAT,30066,
Elementary psychology,"Mohsin, S. M",150.19 MOH,248609,
Elementary real analysis,Bansi Lal,515.8 BAN,175477,
Elementary real and complex analysis,"Shilov, Georgi E.",515 SHI,254370,
Elementary solid state physics: principles and applications,"Omar, M A",530.41 OMA,278430,
Elementary treatise on the dynamics of a particle and of rigid bodies,Loney  S L,531.16 LON,234677,
Elements of biostatistics,"Prasad, S",570.151 PRA,285389,
Elements of cartography,"Robinson, Arthur Howard",526.0221 ROB,98030,
Elements of cartography,"Robinson, Arthur H.",526.0221 ELE,284892,
Elements of civil and mechanical engineering,"Jayagopal, L. S.",624 JAY,233456,
Elements of civil engineering,"Bhavikatti, S. S.",624 BHA,196330,
Elements of control systems,"Gupta, Sudhir",629.8 GUP,233620,
Elements of coordinate geometry,"Loney, S. L",516.16 LON,C8579,
Elements of cost accounting,"Maheshwari, S. N",657.42 MAH,175653,
Elements of cost accounting,"Gupta, Nirmal",657.42 GUP,188924,
Elements of cost-benefit analysis,"Mishan, E. J.",658.1554 MIS,69582,
Elements of differential equations,"Kapoor, N. M",515.35 KAP,113490,
Elements of discrete mathematics,"Liu, C L .",004.0151 LIU,234666,
Elements of electrical engineering,"Dargan, C R",621.3 DAR,232899,
Elements of electronic instrumentation and measurement,"Carr, Joseph J.",621.381548 CAR,233989,
Elements of electronic navigation,"Nagaraja, N. S.",384.51 NAG,304210,
Elements of engineering electromagnetics,"Rao, Nannapaneni Narayana",621.3 RAO,233630,
Elements of engineering electromagnetics,"Rao, Nannapaneni Narayana",621.3 RAO,233631,
Elements of estimating and costing: professional practice,"Rangwala, S. C",692.5 RAN,109669,
Elements of general phonetics,"Abercrombie, David",414.8 ABE,37150,
Elements of information science,"Viswanathan, C.G.",025.04 VIS,298581,
Elements of library classification,"Ranganathan, S.R",025.42 RAN,119065,
Elements of manufacturing processes,"Parashar, B.S. Nagendra",670 PAR,275582,
Elements of mechanical engineering,"Sarao, A. S",621 SAR,138708,
Elements of mercantile law: including company law and industrial law,"Kapoor, N. D",346.07 KAP,106875,
Elements of partial differential equations,"Sneddon, Ian N.",515.353 SNE,234801,
Elements of physical chemistry,"Atkins, Peter",541.3 ATK,314577,
Elements of physics,"Smith, Lpheus W",530 SMI,45284,
Elements of practical geography,"Singh, R.L.",910 SIN,266800,
Elements of properties of matter: with typical numericals solved,"Mathur, D. S",530.124 MAT,49979,
Elements of quantum optics,"Meystre, Pierre",535.15 MEY,285706,
Elements of real analysis,"Wasan, Siri Krishan and Ravi Prakash",515.8 WAS,182648,
Elements of social organization,"Firth, Raymond",301 FIR,3786,
Elements of social psychology,"Bhatia, Hans Raj",302 BHA,103454,
Elements of solid state physics,"Srivastava, J.P.",530.41 SRI,278356,
Elements of structural analysis,"Bari, S. A",624.171 BAR,175788,
Elements of the theory of computation,"Lewis, Harry R.",004.015113 LEW,265788,
Elements of workshop technology,"Choudhury, S. K. Hajra",670 CHO,188324,
Elite politics in rural India: political stratification and political alliances in Western Maharashtra,"Carter, Anthony T",305.52095479 CAR,56238,
Emerging human resource management: blueprint to optimise human assets,"Bhatia, S.K.",658.3 BHA,257983,
Emma,"Austen, Jane",823.6 AUS,178291,
"Employment, technology and development: a study prepared for the international labor office...programme","Sen, Amartya",338.9 SEN,245527,
"Encircling the seamless: India climale change, and the global commons","Damodaran, A.",551.6 DAM,261989,
Encyclopaedia of librarianship,"Landau, Thomas , ed.",020.903 ENC,4135,
Encyclopaedia of social work in India,India. Ministry of Welfare,361.3095403 IND,161711,
Encyclopedia of American history,"Morris, Richard B",973.03 ENC,20134,
Encyclopedia of psychology,"Eysenck, H. J",150.03 ENC,52908,
Energy and natural resources: sustainability and management,"Kumar, H.D.",333.7916 KUM,285333,
Energy conservation: awareness and opportunities,"Ganapathi, Somana",333.7916 GAN,276844,
"Energy science: principles, technologies and impacts","Andrews, John",333.79 AND,276187,
Engineering chemistry,"Gopalan, R",540 GOP,195068,
Engineering chemistry,"Ray, Bidhan Chandra",540 RAY,269843,
Engineering chemistry,"Jain, Preeti.",660 JAI,303083,
Engineering chemistry: a modern approach,"Jain, P. C.",540 JAI,300033,
Engineering drawing and models using Auto CAD solid modeling and designer,"Kirkpatrick, James M",604.202855369 KIR,182432,
Engineering drawing: a course for technical schools of mechanical engineering,"Bogolyubov, S",604.2 BOG,135461,
Engineering drawing: geometrical drawing,"Gill, Pritam Singh",604.2 GIL,301461,
Engineering drawing: plane and solid geometry,"Bhatt, N. D.",604.2 BHA,301470,
Engineering drawing: with a primer on autocad,"Siddiquee, Arshad N et al",604.2 SID,230972,
Engineering electromagnetics,"Hayt, William H.",530.141 HAY,285485,
Engineering fluid mechanics,"Garde,R J",620.106 GAR,233498,
Engineering fluid mechanics,"Roberson, John A.",620.106 ROB,243147,
Engineering fundamentals,"Timings, R. L",620.1 TIM,168076,
Engineering fundamentals of the internal combustion engine,"Pulkrabek, Willard W.",621.43 PUL,240818,
Engineering graphics,"Bapat, A R",604.2 BAP,230645,
Engineering graphics,"Chandra, A.M.",604.2 CHA,240090,
Engineering graphics,"Sharma, S.C.",604.2028566 SHA,251050,
Engineering graphics with auto CAD,"Kulkarni, D.M.",604.202855369 KUL,303085,
Engineering graphics with Auto CAD release 14,"Bethune, James D",604.202855369 BET,182422,
Engineering hydrology,"Subramanya, K",551.48 SUB,248590,
Engineering hydrology,"Subramanya, K",551.48 SUB,248591,
Engineering materials,"Roy Chowdhury, K. P",620.11 ROY,65505,
Engineering materials,"Sharma, S. K",620.1 SHA,R7852,
"Engineering materials technology: structures, processing, properties and selection","Jacobs, James A",620.11 JAC,174038,
Engineering mathematics,"Venkataraman, M. K",510 VEN,165243,
Engineering mathematics,"Arumugam, S",510 ARU,233575,
Engineering Mathematics,"Dass, H. K",510 DAS,303657,
Engineering mathematics-I,Rakesh Mohan,510.76 RAK,251030,
Engineering mechanics,"Basu, A. R",620.1 BAS,168295,
Engineering mechanics,"Mokashi, V. S",620.1 MOK,168353,
Engineering mechanics,"Mokashi, V. S",620.1 MOK,168357,
Engineering mechanics,"Timoshenko, S",620.1 TIM,168485,
Engineering mechanics,"Kumar, K. L",620.1 KUM,182056,
Engineering mechanics,"Jindal, U. C",620.1 JIN,196080,
Engineering mechanics,"Bhavikatti, S S",620.1 BHA,316226,
Engineering mechanics of composite materials,"Daniel, Isaac M.",620.1183 DAN,276100,
Engineering mechanics of solids,"Popov, Egor P",620.105 POP,267086,
Engineering mechanics: statics and dynamics,"Rajasekaran, S",620.1054 RAJ,233324,
Engineering mechanics: statics and dynamics,"Khachane, Jivan",620.1 KHA,251218,
Engineering mechanics: statics part-I,"Jindal, U. C",620.1 JIN,196070,
Engineering metrology,"Jain, R. K",621.37 JAI,111368,
Engineering optimization: theory and practice,"Rao, Singiresu S.",519.3 RAO,233338,
Engineering physics,"Naik, P V",530 NAI,230724,
Engineering physics,"Yadav, V.S.",530.15 YAD,250690,
Engineering problem solving: a classical perspective,"Shaw,Milton C",620.0076 SHA,232171,
Engineering properties of soils and their measurement,"Bowles, Joseph E",624.15136 BOW,168490,
Engineering thermodynamics,"Chattopadhyay, P.",621.4021 CHA,276134,
Engineering thermodynamics,"Nag, P.K.",621.4021 NAG,285137,
Engineering thermodynamics: work and heat transfer,"Rogers, Gordon",621.4021 ROG,181877,
"Engineering, fluid mechanics: including hydraulic mechinery","Garde, R. J",620.106 GAR,107192,
English as a foreign language,"Close, R. A",425 CLO,23716,
English communication made easy,"Rana, Aradhana",428 RAN,301624,
English conversation practice,"Taylor, Grant",428 TAY,182076,
English for students of science,"Roy, A",428 ENG,148258,
English literary criticism: 17th and 18th century,"Atkins, J. W. H",820.9 ATK,11644,
English literature in the sixteenth century: excluding drama,"Lewis, C. S",820.3 LEW,30822,
English novel: short critical history,"Allen, Walter",823.91309 ALL,49141,
English pronouncing dictionary,"Jones, Daniel",421.5203 JON,179077,
English we use,"Close, R. A., comp.",428 ENG,50164,
Enrichment: a history of the public library in the United States in the twentieth century,"Martin, Lowell A.",027.4730904 MAR,X1255,
"Enterprise cloud computing: technology, architecture, applications",Gautam Shroff,004.36 GAU,320177,
Enterprise electronic and mobile commerce,"Jain, V. K.",384.55065 JAI,201299,
Enterprise resource planning: concepts and practice,"Garg, Vinod Kuma.",658.4038 GAR,202077,
Entrepreneur development: new venture creation,"Taneja, Satish",338.040954 TAN,194717,
Entrepreneurial development,"Khanka, S. S",338.040954 KHA,183699,
Entrepreneurship,"Hisrich, Robert D.",658.421 ENT,316563,
Entrepreneurship development,Colombo Plan Staff College for Technician Education (Manila),338.04 COL,182202,
Entrepreneurship development and small business enterprises,"Charantimath, Poornima M.",338.04094 CHA,316461,
Entrepreneurship development: Obstacles and solutions,"Uike, Dipesh D.",338.04 UIK,303153,
Environment and ecology,"Pandey, S.N.",333.7 PAN,284447,
Environment management in India,,658.40950954 ENV,234329,
Environmental  economics in thoery and practice,"Hanley, Nick",333.714 HAN,236576,
Environmental biology,"Trivedi, P. R, ed.",577 ENV,189563,
Environmental biology and toxicology: a text book for university students,"Sharma, P. D",571.95 SHA,205337,
Environmental biology: principles of ecology,"Verma, P. S",577 VER,204663,
Environmental chemistry,"De, Anil Kumar",577.14 DEA,153353,
Environmental ecology,"Trivedi, P. R, ed.",577 ENV,189558,
"Environmental ecology: the ecological effects of pollution, disturbance and other stresses","Freedman, Bill",577.27 FRE,163878,
Environmental economics,"Sankar, Ulaganathan, ed.",333.7 ENV,297052,
Environmental economics: an Indian perspective,"Bhattacharya, Rabindra N. ed.",333.7 ENV,277275,
Environmental economics: theory and applications,Katar Singh,333.7 KAT,259148,
Environmental engineering,"Pandey, G. N",628 PAN,168172,
Environmental engineering,"Narayana Rao, M",628.1 NAR,168218,
Environmental engineering,"Peavy, Howard S.",628.1 PEA,236032,
Environmental engineering,"Pandey, G. N",628 PAN,303017,
Environmental engineering,"Soni, Saurabh Kumar",628 SON,316091,
Environmental engineering: water supply sanitary engineering and pollution,"Kamala, A",628.16825 KAM,168152,
Environmental geography,Savindra Singh,910.13337 SAV,243461,
Environmental management: readings and cases,"Russo, Michael V.",658.4 RUS,274291,
Environmental management: text and cases,"Krishnamoorthy, Bala",333.7 KRI,284756,
Environmental pollution,"Katyal, Timmy",363.73 KAT,189543,
Environmental pollution and management of wastewaters by microbial techniques,"Pathade, G.R",628.168 PAT,204658,
Environmental pollution control engineering,"Rao, C. S",628.168 RAO,153350,
Environmental psychology: a psycho-social introduction,"Bonnes, Mirilia",155.9 BON,174442,
Environmental science and technology: a sustainable approach to green science and technology,"Manahan, Stanley E.",628.168 MAN,285278,
Environmental science: toward a sustainable future,"Wright, Richard T.",333.7 WRI,284716,
Environmental sociology: a social constructionist perspective,"Hannigan, John A",304.2 HAN,175153,
Environmental studies,"Tiwari, Manoj",333.7 TIW,242289,
Environmental studies: from crisis to cure,"Rajagopalan, R.",333.714 RAJ,254769,
Enzyme assays: a practical approach,"Eisenthal, Robert, ed.",572.7 ENZ,275636,
"Equity, trusts and specific relief","Basu, Durga Das",346.004 BAS,285186,
Ernest Hemingway: a comprehensive bibliography,"Hanneman, Audre",016.3054 HAN,43324,
Essays in monetary economics,"Johnson, Harry G",332.401 JOH,C13177,
Essays in positive economic,"Friedman, Milton",332.4 FRI,C16724,
Essays in social administration,"Kulkarni, V. M.",362.954 KUL,63319,
Essays in the philosophy of R. G. Collingwood,"Debbins, William",907.2 ESS,14410,
Essays in the theory of economics,"Robinson, Joan",330.1 ROB,23540,
Essays on the welfare state,"Titmuss, Richard M",362.65 TIT,66031,
Essence of services marketing,"Payne, Adrian",658.8 PAY,229688,
Essential Arabic: a learner's practical guide,"Faynan, Rafi 'el-Imad",492.75 FAY,178873,
Essential biology with physiology,"Campbell, Neil A.",571 CAM,266592,
Essential cell biology: an introduction to the molecular biology of the cell,"Alberts, Bruce",571.6 ESS,183283,
Essential heat transfer,"Long, Christopher",621.4022 LON,234929,
Essential immunology,"Delves, Peter J.",571.96 ESS,285254,
Essential Library of Congress subject Headings,"Broughton, Vanda",025.49 BRO,287392,
Essential mathematical biology,"Britton, Nicholas F.",511.52 BRI,284443,
Essential mathematics,"Sharma, G.C.",510.76 SHA,251019,
Essential organic chemistry,"Bruice, Paula Yurkanis and Prasad, Rajendra K.J.",547 BRU,314062,
Essential PHP for web professionals,"Cosentino, Christopher",005.13 COS,240124,
Essential statistics for economics and commerce,"Hazarika, Padmalochan",330.021 HAZ,242269,
Essentials of biotechnology,"Choudhary, S.S.",660.6 CHO,278540,
Essentials of business communication,"Jain, N.C.",651.7 JAI,241597,
Essentials of business environment,"Aswathappa, K",658 ASW,229887,
Essentials of cardiopulmonary physical therapy,"Hillegass , Ellen",616.1025 HIL,300465,
Essentials of clinical immunology,"Chapel, Helen",616.079 ESS,254526,
Essentials of crystallography,"Wahab, M.A",548 WAH,285616,
Essentials of ecology and environmental science,"Rana, S.V.S.",577 RAN,284805,
Essentials of financial management,"Pandey, I. M",658.15 PAN,190123,
Essentials of genetics,"Khanna, Pragya",576.6 KHA,270546,
Essentials of human anatomy and physiology,"Shier, David",612 SHI,205448,
Essentials of hydraulics,"Jain, P. C",621.2 JAI,66420,
Essentials of management,"Koontz, Harold",658.4 KOO,180550,
Essentials of management,"Singh, B. P",658 SIN,194660,
Essentials of management: an international perspective,"Koontz, Harold",658 KOO,229891,
Essentials of medical pharmacology,"Tripathi, KD",615 TRI,285810,
Essentials of molecular biology,"Freifelder, David",572.8 FRE,248542,
Essentials of molecular biology,"Malacinski, George M",572.8 MAL,286278,
Essentials of oceanography,"Trujillo, Alan P.",551.46 TRU,295012,
Essentials of organizational behavior,"Robbins, Stephen P.",658.4 ROB,207692,
Essentials of orthopaedics and applied physiotherapy,"Joshi , Jayant",616.7075 JOS,300547,
Essentials of orthopedics for physiotherapists,"Ebnezar, John",616.7075 EBN,286253,
Essentials of psychological testing,"Cronbach, J",150.287 CRO,31044,
Estimating and costing in civil engineering: theory and practice including specifications and valuation,"Dutta, B.N.",692.5 DUT,266966,
Ethical choices in business,"Sekhar, R. C",174.4 SEK,176188,
Ethnic plurality in India,,305.80954 SCH,96875,
Ethnicity and urbanization: a case study of the ethnic identity of South Indian migrants in Poona,"Nair, K. Sadanandan",307.760954 NAI,64515,
Ethnicity: theory and experience,"Glazer, Nathan, ed.",305.8 ETH,38268,
Euro-Currency market: structure and working,Khan Masood Ahmad,332.45 KHA,177494,
Europe since Napolean,"Thomson, David",940.27 THO,49170,
Evaluation and development of ground water,"Mahajan, Gautam",551.49 MAH,278314,
Event marketing and management,"Gaur, Sanjaya Singh",658.8 GAU,200161,
Everyday dialogues in English,"Dixson, Robert J.",428.3 DIX,301587,
Evolution,"Strickberger, Monroe W",576.8 STR,177816,
Evolution of an information society,"Cawkell, A. E",303.483 EVO,145320,
Evolution of geographical thought,Majid Husain,910.92 MAJ,278309,
Evolution of the international monetary system: historical reapprisal and future pespectives,"Triffin, Robert",332.152 TRI,37837,
Example illustrating AACR-2 1988 revision,"Hunter, Eric J",025.32 HUN,135381,
Excercises in modern mathematics,"Marjoram, D. T. E",511.3 MAR,46778,
Exercise physiology: nutrition energy and human performance,"Mcardle , William D.",612.044 MCA,300521,
Exercise testing and prescription lab manual,"Acevedo , Edmund O.",615.82 ACE,300409,
Exercise therapy: prevention and treatment of disease,"Gormley , John ed.",615.82 EXE,300398,
Exercises in the 19th edition of the dewey decimal classification,"Satija, M.P",025.431 SAT,201069,
Experimental organic chemistry,"Kemp, William",547 KEM,183409,
Experimental organic chemistry: standard and microscale,"Harwood, Laurence M.",547 HAR,316806,
Experimental psychology,"Woodworth, Robert S",150.724 WOO,285848,
Experimental psychology with advanced experiments,"Rajamanickam, M",150.724 RAJ,285831,
Experimental psychology: a case approach,"Solso, Robert L",150.0724 SOL,232644,
Experimental stress analysis: A text book for engineers and students of degree & post graduate classes,Abdul Mubeen,624.176 ABD,188314,
Experiments in plant physiology.: with 48 figures.,"Bajracharya,Dayananda.",571.2 BAJ,206757,
Experiments in psychology,"Mohsin, S. M",150.724 MOH,205199,
Expert data structures with C,"Patel, R.B.",005.73 PAT,303074,
Explorations: essays in criticism mainly on the literature,"Knights, L. C",824 KNI,20868,
Exploring psychology,"Myers, David G",150 MYE,166876,
Export management,"Khurana, P. K.",382.6 KHU,204465,
Export marketing: a practical guide for exporters,"Shiva Ramu, S.",658.848 SHI,180594,
Export marketing: strategies for success: a primer for Indian managers,"Bhattacharyya, B.",658.83954 BHA,194156,
Fables and stories,Zakir Husain,891.439042 ZAK,55930,
Faculty development for teaching engineering,Rajnish Prakash,378.170281 RAJ,299907,
Family and planning in India,"Mukherjee, Ramakrishna",306.830952 MUK,60322,
Family planning in India: policy and administration: proceedings of three seminars,"Jagannadham, V",363.960954 FAM,53275,
Fast track to NT server 4,"Cowart, Robert",004.1 COW,174795,
"Faster smarter PCs: take charge of your computer faster,smarter, better","Clark, Scott H A",004.1 CLA,231329,
Federal government,"Wheare, K. C",351 WHE,R992,
Feminism and modern philosophy: an introduction,"Nye, Andrea",190.82 NYE,254859,
Fertility behaviour: population and society in a Rajasthan village,"Patel, Tulsi",304.63209544,176928,
Fiber optics and optoelectronics,"Khare, R.P.",621.38275 KHA,276066,
Field methods in remote sensing,"McCoy, Roger M.",526.982 MCC,241255,
Field of social work,"Fink, Arthur E",361.3 FIN,62009,
Fields virology,"Knipe, David M., ed.",616.0914 FIE,253468,
Fifty key sociologists: the contemporary theorists,"Scott, John, ed.",301.092 FIF,247487,
Finance of foreign trade and foreign exchange,"Chaudhuri, B. K",332.45 CHA,176441,
Financial accounting,"Monga, J. R",657.48 MON,167108,
Financial accounting,"Banerjee, Ashok",657.48 BAN,175578,
Financial accounting,"Tulsian, P. C",657.48 TUL,176622,
Financial accounting,"Banerjee, Ashok",657.48 BAN,194149,
Financial accounting for management: text and cases,"Sharma, Subhash",657.48 SHA,199977,
Financial accounting: a managerial perspective,"Narayanaswamy, R",657.48 NAR,229876,
Financial accounting: A simplified approach,Naseem Ahmed.,657.48 NAS,204084,
Financial accounting: concepts and applications,"Monga, J. R.",657.48 MON,195235,
Financial accounting: text and problems,Jawahar Lal,657.48 JAW,296860,
Financial and cost accounting,"Ansari, A. Aziz",657.48 ANS,260919,
Financial and management accounting,"Maheshwari, S. N.",658.1511 MAH,194082,
"Financial decision making: concepts, problems and cases","Hampton, John J.",658.15 HAM,266970,
Financial economics: theory and practice,"Avadhani, V. A",332 AVA,191175,
Financial institutions and markets,"Kohn, Meir",332.10973 KOH,197583,
"Financial institutions and markets: structure, growth and innovations","Bhole, L. M",332.10973 BHO,285582,
Financial management,"Inamdar, Satish M.",658.15 INA,179209,
Financial management,"Banerjee, Subir Kumar",658.15 BAN,183693,
Financial management,"Pandey, I M",658.15 PAN,229885,
Financial management,"Srivastava, Rajiv",658.15 SRI,277451,
Financial management,"Reddy, B. Ramachandra",658.15 RED,301314,
Financial management and policy,"Van Horne, James C",658.15 VAN,301548,
Financial management.,"Khan, M.Y.",658.15 KHA,229658,
Financial management: problems and solutions,"Kishore, Ravi M.",658.15 KIS,250088,
"Financial management: text, problems and cases","Khan, M. Y.",658.15 KHA,301559,
Financial management: theory and practicde,Prasanna Chandra,658.15 PRA,229856,
"Financial management: theory, concepts and problems : incorporating the emerging trends in Indian capital market","Rustagi, R. P.",658.1501 RUS,194753,
Financial markets and services,"Gordon, E",332.10954 GOR,191195,
Financial services,"Khan, M. Y",332.10954 KHA,176640,
Financial services in India,"Avadhani, V.A.",332.10954 AVA,296779,
Finite element primer,"Selvem, V. K. Manicka",515.62 SEL,177271,
Finite element procedures,"Bathe, Klaus-Jurgen",515.62 BAT,174728,
Finite elements analysis: theory and programming,"Krishnamoorthy, C. S",620.001515353 KRI,168167,
Finite group theory,"Aschbacher, M",515.62 ASC,199333,
Finite mathematics: with applications in the social and managment sciences,"Kattsoff, Louis O",510 KAT,44555,
Finnie's handling the young child with cerebral palsy at home,"Bower, Eva, ed.",616.836 FIN,286477,
First course in computers,"Saxena, Sanjay",004 SAX,191739,
First course in functional analysis,"Goffman, Casper",515.7 GOF,183567,
First course in mathematical analysis,"Somasundaram, D",515 SOM,238393,
First course in metric spaces,"Tyagi, B. K.",512.9434 TYA,315769,
First course in real analysis,"Arora, Prem Nath",515.8 ARO,243519,
First course in string theory,"Zwiebach, Barton",539.7258 ZWI,278404,
First course in the finite element method,"Logan, Daryl L.",620.001515353 LOG,203988,
First course on numerical analysis and error estimation,Naseem Ahmad,518.43 NAS,301122,
First handbook of psychological and social instruments,"Pareek, Udai",155.0284 PAR,249458,
First principles of economics,"Lipsey, Richard G",330 LIP,166245,
Fitter shop theory and practice,"Gupta, N. K.",670.42 GUP,234881,
Fitter shop theory and practice,"Gupta, N. K.",670.42 GUP,234882,
Fitter shop theory and practice,"Gupta, N. K.",670.42 GUP,234883,
Fitting simplified,"Sethi, G S.",621 SET,233422,
Five laws of library science,"Ranganathan, S. R",020 RAN,119067,
Flow through open channels,"Ranga Raju, K. G",627.23 RAN,177826,
Fluid flow machines,"Govinda Rao, N. S",621.2 GOV,120728,
Fluid mechanics,"Mohanty, A. K",620.106 MOH,177313,
Fluid mechanics,"Spurk, Joseph H",532.05 SPU,192167,
Fluid mechanics,"Pnueli, David",620.106 PNU,315751,
Fluid mechanics and hydraulic: with computer applications: in S I & M K S Units,Jagdish Lal,621.2 JAG,196298,
Fluid mechanics and machinery,"Agrawal, S.K.",620.106 AGR,250653,
Fluid mechanics and machinery,"Agrawal, S.K.",620.106 AGR,250654,
Fluid mechanics and machinery,"Ojha, C.S.P.",620.106 OJH,276127,
"Fluid mechanics, fluid machines and hydraulics","Gupta, V. P",620.106 GUP,203514,
"Fluid mechanics, hydraulics and fluid machines","Ramamrutham, S",621.2 RAM,196286,
Fluid mechanics: fundamentals and applications,"Cengel, Yunus A.",620.106 CEN,247560,
Flunctional analysis with applications,"Choudhary, B",515.7 CHO,234737,
Fluorescence and phosphorescence spectroscopy,"Rendell, David",543.0858 REN,316709,
Folk art in Rumania,,745.3 FOL,C7760,
Foot and ankle pain,"Cailliet, Rene",617.585 CAI,285800,
Foreign aid and foreign policy,"Mason, Edward S.",338.91 MAS,C8226,
Foreign exchange & risk management,"Jeevanandam, C",332.45 JEE,235901,
Foreign exchange international finance & risk management,"Rajwade, A. V",332.45 RAJ,177562,
Foreign exchange simplified,"Srinivasan, B",332.45 SRI,235867,
Foreign trade and foreign exchange: for students of MBA/MMS for paper of international finance,"Agarwal, O.P.",382 AGA,296889,
Foreign trade financing and foreign exchange,"Suneja, H. R",332.45 SUN,109062,
Foreign trade management in India,"Varma, M. L.",382.0954 VAR,165935,
"Foreign trade policy: 1st September, 2004 - 31st March, 2009",India. Ministry of Commerce and Industry. Department of Commerce,382 IND,229680,
Foreign trade policy: ITC (HS) classification of export and import items 2004-2009 with customs tariff ready reckoner,"Malhotra, Sanjiv",382 MAL,229685,
FORTRAN 77: with applications to science and engineering,"Jain, P. K",005.362 JAI,180786,
Foundation,"Asimov, Isaac",423 ASI,284506,
Foundation accounting,"Monga, J. R",657 MON,195218,
Foundation analysis and design,"Bowles, Joseph E",624.15 BOW,181971,
Foundation design manual,"Nayak, Narayan V",624.150202 NAY,177261,
Foundation in microbiology,"Talaro, Kathleen",576 TAL,177818,
Foundation mathematics for the physical sciences,"Riley, K.F.",510 RIL,315772,
Foundations of advertising: theory and practice,"Chunawalla, S.A.",659.1 CHU,296915,
Foundations of algorithms,"Neapolitan, Richard E.",518.1 NEA,314773,
Foundations of behavioral research,"Kerlinger, Fred N",300.072 KER,196307,
Foundations of complex analysis,"Ponnusamy, S",515.9 PON,238425,
Foundations of computer science: from data manipulation to theory of computation,"Forouzan, Behrouz A.",004 FOR,233117,
Foundations of electromagnetic theory,"Reitz, John R",537.1 REI,49201,
Foundations of electromagnetic theory,"Reitz, John R",530.141 REI,299222,
