Title,Author,CallNo,AccNo,
Physical rehabilitation for the physical therapist assistant,"Cameron, Michelle H.",615.82 PHY,286511,
Physical rehabilitation of the injured athlete,"Andrews , James R. ed",617.1027 PHY,300394,
Physical therapy of the shoulder,"Donatelli, Robert A. ,ed.",617.57206 PHY,286603,
Physics,"Resnick, Robort",530 RES,147196,
Physics,"Wilson, Jerry D",530 WIL,196174,
Physics,"Cutnell, John D",530 CUT,197694,
Physics by example: 200 problems and solutions,"Rees, W. G",530.076 REE,177285,
Physics experiments and projects for students,"Isenberg, C , ed.",530.028 PHY,178498,
Physics handbook for science and engineering,"Nordling, Carl",530.0202 NOR,246098,
Physics of atoms and molecules,"Bransden, B H",539.7 BRA,242043,
Physics of atoms and molecules,Suresh Chandra,539.7 SUR,284147,
Physics of atoms and moleules,"Bransden, B.H.",539.7 BRA,278395,
Physics of semiconductor devices,"Roy, Dilip K",537.622 ROY,179355,
Physics of semiconductor devices,"Shur, Michael",537.622 SHU,278365,
Physics of semiconductor devices,"Sze, S.M",537.622 SZE,299525,
Physics of waves and oscillations,"Bajaj, N. K",531.3 BAJ,299759,
Physics Problems: with solutions,"Chen, Min",530 CHE,234582,
"Physics, properties and applications of electrical engineering materials","Seth, Surinder Prakash",621.3 SET,177251,
Physics: a general course,"Savelyev, I. V",530 SAV,98435,
Physiology of the joints,"Kapandji, A.I.",612.75 KAP,286610,
Physiotherapy for children,"Pountney, Teresa, ed.",615.820832 PHY,286483,
Plane and geodetic surveying,"Clark, David",526.9 CLA,149134,
Plane trigonometry,"Loney, S. L",516.242 LON,249106,
Planning and the poor,"Minhas, B. S",307.120954 MIN,67050,
Planning in India: 1951-1978,"Desai, P. B",338.95404 DES,75272,
Planning library buildings,"Faruqi, Khalid Kamal",022.3 RAR,178380,
Plant anatomy and embryology,"Pandey, S.N",571.3 PAN,199677,
Plant biochemistry,"Heldt, Hans-Walter",581 HEL,276634,
Plant biology,"Rost, Thomas L",580 PLA,191849,
Plant biology,"Lack, A. J",581 LAC,201371,
Plant pathology,"Agrios, George N.",571.92 AGR,285442,
Plant physiology,"Devlin, Robert M",571.2 DEV,175769,
Plant physiology,"Salisbury, Frank B",571.2 SAL,175773,
Plant physiology,"Taiz, Lincoln",571.2 TAI,285596,
Plant viruses as molecular pathogens,"Khan, Jawaid A., ed.",579.28 PLA,285294,
Plasma techniques for film deposition,"Konuma, Mitsuharu",530.444 KON,278587,
Plumbing and sanitation,"Gupta , K N.",696.1 GUP,233287,
Plumbing: design and practice,"Deolalikar, S G",696.1 DEO,168133,
PNF in practice: an illustrated guide,"Adler , Susan S.",616.744 ADL,300393,
Pocketbook of neurological physiotherapy,"Lennon, Sheila, ed.",615.8074 POC,286512,
Political and social thought in the contemporary Middle East,"Karpat, Kemal H., ed.",320.50956 POL,C10962,
Political culture,"Rosenbaum, Walter A",320.01 ROS,69222,
Political ecology: a critical introduction,"Robbins, Paul",910.13042 ROB,236406,
Political geography,"Adhikari, Sudeepta",910.132 ADH,195983,
Political geography of India: a contemporary perspective,"Adhikari, Sudeepta",910.1320954 ADH,258892,
Political ideas and movements in India,"Ghose, Sankar",320.50954 GHO,57353,
Political mobilization: a sociological analysis of methods and concepts,"Nettl, J. P",306.2 NET,56762,
Political roles in a new state Tanzania's first decade: Tanzania's first decade,"Hopkins, Raymond F",967.804 HOP,X99,
Political sociology in India: contemporary trends,"Gupta, Dipankar",306.2 GUP,179343,
Political sociology: an introductory analysis,"Mukhopadhyay, Amal Kumar",306.2 MUK,65628,
Political theory,"Asirvatham, Eddy",320.01 ASI,74826,
Political theory: an introduction,"Heywood, Andrew",320.01 HEY,297351,
Political theory: an introduction,"Bhargava, Rajeev, ed.",320.01 POL,317690,
Political theory: principles of political science: including modern political analysis (modern and Marxist concept),"Agarwal, R. C",320.01 AGA,102500,
Political thought,"Wayper, C. L",320.9 WAY,C7864,
Politics and change in developing countries,"Leys, Collin",320.91724 POL,X535,
Politics and sociology in the thought of Max Weber,"Giddens, Anthony",306.2 GID,97706,
Politics in India,"Kothari, Rajni",320.954 KOT,69279,
Politics with in nations,"LaPalombara, Joseph",320.3 LAP,38398,
Pollution and biomonitoring,"Rana, B. C",628.168 RAN,164682,
Polymer science and technology of plastics and rubbers,"Ghosh, Premamoy",668.9 GHO,179775,
Polymers for electronic and photonic applications,"Wong, C. P., ed.",621.381 POL,264340,
Polymorphism and polytypism in crystals,"Verma, Ajit Ram",548.3 VER,47034,
Popular culture,"Pickering, Michael, ed.",306 POP,270298,
Population,"Peterson, William",304.6 PET,73374,
Population geography,"Qazi, S.A.",304.60954 QAZ,284776,
Population geography: tools and issues,"Newbold, K. Bruce",304.60954 NEW,294993,
Population theories and demographic analysis,"Ghosh, B. N",304.601 GHO,153579,
Poretins and priteomics: A loboratory manual,"Simpson , Richard J.",572.6 SIM,228961,
Portfolio management,"Barua, Samir K",332.641 BAR,193516,
Post Keynesian macroeconomic theory: a foundation for successful economic policies for the twenty-first century,"Davidson, Paul",339.010905 DAV,286133,
Poverty in India,"Dandekar, V. M",339.460954 DAN,74863,
"Poverty, planning and social transformation","Kurien, C. T",338.954 KUR,65327,
Power electronics,"Bhimbhra, P. S",621.317 BIM,193809,
Power electronics,"Jamil Asghar, M S",621.317 JAM,231290,
Power electronics,"Hari Babu, K",621.317 BAB,233582,
Power electronics,"Sen, P. C",621.317 SEN,240185,
Power electronics,"Bimbhra,P.S.",621.317 BIM,301889,
"Power electronics: circuits, devices, and applications","Rashid, Muhammad H",621.317 RAS,303021,
Power plan engineering,Elanchezhian. C,621.3121 ELA,314905,
Power plant engineering: steam and nuclear,"Nag, P. K",621.3121 NAG,182234,
Power system analysis,Hadi Saadat,621.3191 HAD,235997,
Power system engineering,"Nagrath, I. J",621.31 NAG,177850,
Power system optimization,"Kothari, D P",621.3121 KOT,230944,
Power system protection and switchgear,"Ravindranath, B",621.317 RAV,119781,
Power system protection and switchgear,Badri Ram,621.317 BAD,234058,
Power system transients: a statistical approach,"Indulkar, C. S",621.31 IND,202966,
Power systems analysis,"Bergen, Arthur R",621.3191 BER,234032,
Practical approach to business staistics: problems and solutions,"Shukla, S M.",519.5 SHU,235494,
Practical automobile engineering,"Gupta, K .N.",629.2 GUP,235076,
"Practical cataloguing: AACR, RDA and MARC 21","Welsh, Anne",025.3 WEL,287395,
Practical chemistry: a textbook for B. Sc. students of Indian universities,"Giri, S",540 GIR,204242,
Practical fracture treatment,"Mcrae, Ronald",617.15 MCR,286604,
Practical geography,"Ishtiaq, M",910 ISH,119453,
Practical Geography,"Singh, L.R.",912 SIN,241207,
Practical geography: a systematic approach,"Sarkar, Ashish",912 SAR,295027,
Practical map production,"Loxton, John",912.0148 LOX,111206,
Practical organic chemistry,"Mann, Frederick George",547.0028 MAN,207127,
Practical organic chemistry for the beginners,"Das, Tanya",547.0028 DAS,269847,
Practical Organic Chemistry: qualitative analysis,"Bhutani, S. P.",547.0028 BHU,301084,
Practical physics,Harnam Singh,530 HAR,65966,
Practical physics,"Squires, G.L.",530.028 SQU,314883,
Practical problems in advanced accounts,"Shukla, S. M",657.046 SHU,106839,
Practical problems in cost accounting,"Agarwal, M. L",657.42 AGA,189865,
Practical quantum mechanics,"Flugge, Siegfried",530.12 FLU,107343,
Practical standard 21st century dictionary: Urdu into English,"Qureshi, Bashir Ahmad, comp.",491.439321 PRA,239157,
Practical taxonomy of angiosperms,"Sinha, R.K.",580 SIN,270585,
Practical thermodynamics: with questions and answers,"Rai, G. D",621.4021 RAI,111386,
Practice of social research: social work perspective,"Das, D. K. Lal",300.72 DAS,206067,
Pradeep's objective physics,"Gomber, K. L.",530.76 GOM,217802,
"Prescott, Harley, and Klein's microbiology","Willey, Joanne M.",579 WIL,284213,
Prescott's microbiology,"Willey, Joanne M.",579 WIL,277629,
Prestressed concrete,"Ramamrutham, S",624.18341 RAM,119728,
Prestressed concrete,"Krishna Raju, N",624.183412 KRI,168162,
Prestressed concrete,"Raju, N Krishna.",624.1834 RAJ,236049,
Price theory and its uses,"Watson, Donald Stevenson",338.521 WAT,180837,
Pride and prejudice,"Austen, Jane",823.6 AUS,1919,
Princeples of  inorganic chemistry,"Puri, B R.",546 PUR,236635,
Principle and practice of insurance,"Periasamy, P",368 PER,303169,
Principles  and applications  of electrical engineering,"Salam, M.A.",621.3 SAL,275610,
Principles and applications of GSM,"Garg, Vijay K.",384.5 GAR,234092,
Principles and method of social psychology,"Hollander, Edwin P",302.072 HOL,74831,
Principles and practice of accounting,"Ghosh, T. P.",657 GHO,194769,
Principles and practice of auditing,"Pagare, Dinkar",657.45 PAG,175654,
Principles and practice of business organization and management,"Sinha, J. C",658.1 SIN,101314,
Principles and practice of management,"Prasad, L. M.",658 PRA,105290,
Principles and practice of management,"Saksena, S. C",658 SAK,189873,
Principles and practices of software engineering,"Mehrotra, Monica",005.1 MEH,314860,
Principles and techniques of biochemistry and molecular biology,"Wilson, Keith, ed.",572.8 PRI,319906,
Principles of  physical biochemistry,"Van Holde, Kensal E.",572.43 VAN,236413,
Principles of air conditioning,"Lang, V. Paul",697.93 LAN,181799,
Principles of angiosperm taxonomy,"Davis, P.H.",580 DAV,285462,
Principles of applied psychology,"Poffenberger, A. T",158 POF,R6638,
Principles of biochemistry,"Zubay, Geoffrey",572 ZUB,183280,
Principles of biochemistry,"Voet, Donald",572 VOE,285400,
Principles of biostatistics,"Pagano, Marcello",570.15195 PAG,286271,
Principles of business organisation and management,"Reddy, P. N",658 RED,183681,
Principles of cartography,"Raisz, Erwin",526.0221 RAI,62879,
Principles of cellular and molecular immunology,"Austyn, Jonathan M",571.96 AUS,154093,
Principles of chemical equilibrium: with applications in chemistry and chemical engineering,"Denbigh, Kenneth",541.392 DEN,69934,
Principles of company law,"Shukla, M. C",346.066 SHU,106643,
Principles of corporate finance,"Brealey, Richard A",332.63234 PRI,301519,
Principles of database systems,"Ullman, Jeffrey D",005.74 ULL,229714,
Principles of digital communication,"Gallager, Robert G.",621.382 GAL,314318,
Principles of econometrics: an introduction (using R),"Hatekar, Neeraj R.",330.15195 HAT,270994,
Principles of economics,"Sundharam, K. P. M",330.1 SUN,105083,
Principles of economics,"Agarwal, H.S.",330.1 AGA,276872,
Principles of electrical engineering,"Del Toro, Vincent",621.3 DEL,133213,
Principles of electricity an,"Palit, Saunak",537 PAL,284157,
Principles of electronic devices and circuits: analog and digital,"Theraja, B.L.",621.3815 THE,240968,
Principles of electronics,"Gavin, M. R",537.5 GAV,49167,
Principles of electronics,"Mehta, V.K.",537.5 MEH,315306,
Principles of environmental engineering,"Anandan, P.",628 ANA,233546,
"Principles of environmental studies: ecology, economics, management and law","Manoharachary, C",363.70954 MAN,241845,
Principles of exercise therapy,"Gardiner, M. Dena",615.8 GAR,286515,
Principles of financial management,"Rustagi, R. P",658.15 RUS,285170,
Principles of gene manipulation,"Primorse, Sandy",572.86 PRI,236328,
Principles of gene manipulation and genomics,"Primrose, S.B.",660.65 PRI,278641,
Principles of genetics,"Simmons, Michael J",576.5 GAR,176244,
Principles of genetics,"Gardner, Eldon John",576.5 GAR,266926,
Principles of genome analysis and genomics,"Primrose, Sandy B",572.8633 PRI,228971,
Principles of geomorphology,"Thornbury, William D",551.41 THO,183052,
Principles of geotechnical engineering,"Das, Braja M.",624.1513 DAS,316528,
Principles of hospital administration and planning,"Sakharkar, B M",362.17 SAK,286258,
Principles of human geography,"Hunfingfon, Ellsworth",910.1304 HUN,8786,
Principles of information security,"Whitman, Michael E.",005.8 WHI,319919,
Principles of inorganic chemistry: a text book,"Puri, B.R.",546 PUR,285563,
Principles of interactive computer graphics,"Newman,William M.",006.6 NEW,300369,
Principles of literary criticism,"Richards, I. A",801.95 RIC,50246,
Principles of macroeconomics,"Rangarajan, C.",339.01 RAN,241580,
Principles of macroeconomics,"Sikdar, Soumyen",339.01 SIK,255101,
Principles of management,"Tripathi, P. C",658 TRI,164908,
Principles of management,"Hill, Charles W.L.",658 HIL,256432,
Principles of management,"Kesavan, R.",658 KES,256555,
Principles of management,"Vasishth, Neeru",658.001 VAS,301333,
Principles of management accounting,"Maheshwari, S. N.",658.1511 MAH,173920,
Principles of manufacturing materials and processes,"Campbell, James S.",671 CAM,168302,
Principles of marketing,"Kotler, Philip",658.8 KOT,229851,
Principles of materials science and engineering,"Smith, William F",620.11 SMI,168481,
Principles of measurement and instrumentation,"Morris, Alan S",621.381548 MOR,231374,
Principles of measurement systems,"Bentley, John P.",530.81 BEN,240550,
Principles of mechanics,"Synge, John L",531 SYN,47023,
Principles of microbiology,"Atlas, Ronald M",579 ATL,182849,
Principles of microeconomics,"Tewari, D. D",338.5 TEW,180826,
Principles of microeconomics,"Salvatore, Dominick",338.5 SAL,276232,
Principles of modern physics,"Saxena, A.K.",530.01 SAX,284137,
Principles of neural science,"Kandel, Eric R., ed.",611.8 PRI,205443,
Principles of neuromusculoskeletal treatment and management: a handbook for therapists,"Petty, Nicola J., ed.",616.74405 PRI,286481,
Principles of optics,"Mathur, B. K",535 MAT,C6750,
Principles of organizational behaviour,"Fincham, Robin",658.4 FIN,277400,
Principles of physical chemistry,"Maron, Samuel H",541.3 MAR,230373,
Principles of physical chemistry,"Puri, B. R",541.3 PUR,303115,
Principles of physical chemistry,"Maron, Samuel H",541.3 MAR,C13951,
"Principles of physical Chemistry: Understanding molecules, molecular assemblies supramolecular machines","Kuhn, Hans",541.3 KUH,197954,
Principles of physical geography,"Monkhouse, F. J.",910.02 MON,62251,
Principles of physics,"Halliday, David",530 HAL,285128,
Principles of physics: International student version,"Walker, Jearl",530 WAL,320768,
Principles of political science,"Agarwal, N. N",320.01 AGA,176217,
Principles of political science,"Kapur, Anup Chand",320.01 KAP,177492,
Principles of political science,"Agarwal, N. N",320.01 AGA,196397,
Principles of political science,"Kapur, Anup Chand",320.01 KAP,266935,
"Principles of power system: including generation, transmission, distribution, switchgear and protection","Mehta, V. K",621.3191 MEH,317757,
Principles of protein structure,"Schulz, G. E.",547.75 SCH,146480,
Principles of quantum mechanics,"Dirac, P.A.",530.12 DIR,285632,
Principles of real analysis,"Gupta, S L",515.8 GUP,234672,
Principles of refrigeration,"Dossat, Roy J",621.564 DOS,232163,
Principles of remote sensing,"Patel, A. N",526.982 PAT,183013,
"Principles of the law of crimes in British India: Tagore law lectures, 1902",Shamshul Huda,345.02 SHA,120546,
Principles of the law of sale of goods and hire purchase,Avtar Singh,343.0552 AVT,120830,
Principles of the solid state,"Keer, H. V",530.41 KEE,207886,
Principles of the theory of solids,"Ziman, J.M.",531 ZIM,320257,
Principles of transportation and highway engineering,"Venkatappa Rao, G",VEN,164861,
Principles of vibration,"Tongue, Benson H.",531.32 TON,276091,
"Principles of virology: molecular biology, pathogenesis, and control","Flint, S. J",579.2 PRI,192249,
Principles of VLSI,"Roy, Dilip Kumar",621.395 ROY,248386,
Prison administration in India: with special reference to Uttar Pradesh,Vidya Bhushan,365.0680954 VID,56054,
Probability and random  processes with applications to the signal processing,"Stark, Henry.",621.3822 STA,203536,
"Probation and parole: legal and social dimensions,","Carney, Louis P",364.62 CAR,101114,
Problem & solution of engineering electromagnetics,,621.3 PRO,203717,
Problem of India economy,"Sen, Annirudha",330.954 PRO,180828,
Problem solving in science,Narendera Vaidya,371.95335 NAR,49650,
Problems and solutions in advanced accountancy,"Maheshwari, S. N.",657.076 MAH,194061,
Problems and solutions of electronic devices and circuits,,621.3815 PRO,303066,
Problems and solutions of engineering electromagnetics,,621.3 PRO,203718,
"Problems and solutions on atomic, nuclear and particle physics","Lim, Yung-Kuo, ed.",539.7 PRO,278419,
Problems and solutions on quantum mechanics,"Lim, Yung-Kuo, ed.",530.12 PRO,278425,
Problems and solutions on thermodynamics and statistical mechanics,"Lim, Yung-Kuo, ed.",536.7 PRO,278415,
Problems and their solution in organic chemistry,"Finar, I.L.",547 FIN,315276,
Problems in electrical engineering: with answers,"Smith, S. Parker",621.3 SMI,R1235,
Problems in general physics,"Irodov, I. E",530 IRO,299191,
Problems in physical chemistry,"Sharma, K. K",541.3 SHA,196091,
Problems in physics,"Dhar, B. L",530 PRO,67373,
Problems in reinforced concrete design,"Saxena, N. K",624.18341,203690,
Problems in structural inorganic chemistry,"Li, Wai-Kee",546.252 PRO,301161,
Problems of capital formation in underdeveloped countries,"Nurkse, Regnar",338.90091724 NUR,23558,
Problems of modern society: a sociological perspective,"Worsley, Peter",301 PRO,51757,
Problems on physical chemistry,"Pahari, S.",541.3 PAH,269900,
Procedural elements for computer graphics,"Rogers, David F.",006.6 ROG,238374,
Procedures in scanning probe microscopies,"Colton, Richard J., ed.",620.5 PRO,274488,
Proceedings of the International Conference on algebraic groups and arithmetic,"Dani , S.G, ed.",512.2 ALG,234767,
Process biotechnology fundamentals,"Mukhopadhyay, S.N.",660.6 MUK,201407,
Product management in India,"Majumdar, Ramanuj",658.8 MAJ,271954,
Product management: text and cases,"Mukerjee, Kaushik",658.50954 MUK,271948,
"Product management: text, application and cases","Chandrasekar, K.S.",658.5 CHA,296759,
Product policy and brand management: text and cases,"Chitale, A.K.",658.5 CHI,271960,
Production and costing,"Narang, G. B. S.",338.51 NAR,233392,
Production technology,"H M T, Bangalore",681.1 PRO,236010,
Professional communication,"Raina, Roshan Lal",658.45 RAI,296920,
Professional Java server programming J2EE 1.3 edition,"Allamaraju, Subrahmanyam",005.2762 PRO,267245,
Professional visual C++6 programming,"Holzner, Steven",005.118 HOL,285381,
Programing in C: a practical approach,"Mittal, Ajay",005.133 MIT,272971,
Programmer's guide to Java SCJP certification: a comprehensive primer,"Mughal, Khalid A",005.362 MUG,299550,
Programming in ANSI C,"Balaguruswamy, E.",005.262 BAL,314768,
Programming in BASIC,"Balagurusamy, E",005.362 BAL,182039,
Programming in BASIC: including IBM PC BASIC,"Balagurusamy, E",005.362 BAL,118833,
Programming in c,"Ghosh, Smarajit",005.133 GHO,231754,
Programming in C & PC application:,"Rajagopalan, S. P",005.133 RAJ,201352,
Programming in C ++,"Litvin ,Maria",005.133 C LIT,201666,
Programming in C: ANSI,"Balagurusamy, E.",005.133 BAL,238314,
Programming in visual basic NET,"Bradley, Julia Case",005.133V BRA,300325,
Programming java: an introduction to programming using java,"Decker, Rick",005.133 DEC,199780,
Programming languages: concepts and constructs,"Sethi, Ravi",005.13 SET,177155,
Programming the World Wide Web,"Sebesta, Robert W.",004.67 SEB,257568,
Programming using the C language,"Hutchison, Robert C",005.133 HUT,205469,
Programming with ANSI and TURBO C,"Kamthane, Ashok N.",005.262 KAM,274435,
Programming with C,"Gottfried, Byron S",005.133C GOT,317722,
Programming with FORTRAN 77,Kumar RAM,005.362 KUM,159152,
Programming with JAVA: a primer,"Balagurusamy, E.",005.362 BAL,315311,
Programming with visual basic 6.0,"Azam, Mohammed",005.362 AZA,231945,
Project using C: with concepts and algorithms,"Varalakshmi, P V N",005.133 VAR,233524,
Projects using C++,"Varalakshmi, P V N",005.133 VAR,233534,
"Projects: planning, analysis, selection, implementation, and review",Prasanna Chandra,658.404 PRA,197585,
Prolog: programming for artificial intelligence,"Bratko, Ivan",006.336 BRA,265770,
Properties of concrete,"Neville, A. M",624.1834 NEV,301451,
Proteins: structures and molecular properties,"Creighton, Thomas E .",572.6 CRE,236318,
Proteolytic enzymes: a practical approach,"Beynon, R. J",572.76 PRO,198949,
Protestant ethic and the spirit of capitalism,"Weber, Max",305 WEB,61761,
Psychiatric social work,"French, Lois Meredith",362.2 FRE,R2598,
Psychological consequences of prolonged deprivation,"Misra, Girishwar",155.92 MIS,111966,
Psychological testing and assessment,"Kaplan, Robert M",150.287 KAP,276938,
Psychological testing: a practical approach,"Miller, Leslie A.",150.287 MIL,320350,
Psychology,"Crider, Andrew B",150 PSY,166884,
Psychology,"Darley, John M",150 DAR,166886,
Psychology,"Baron, Robert A",150 BAR,175174,
Psychology,"Ciccarelli, Saundra K.",150 CIC,285883,
Psychology applied to modern life: adjustment in the 21st century,"Weiten, Wayne",155.2 WEI,276943,
Psychology applied to work: an introduction to industrial and organizational psychology,"Muchinsky, Paul M",158.7 MUC,193834,
"Psychology for living: adjustment, growth, and behavior today","Atwater, Eastwood",150 ATW,178055,
Psychology in practice: organisations,"Coolican, Hugh",158.7 COO,254755,
Psychology of sensation and perception,"Goldstein, E. Bruce",152.1 GOL,276948,
Psychology: an introduction,"Morris, Charles G",150 MOR,166891,
Psychology: an introduction,"Gerow, Josh R",150 GER,182794,
"Psychology: science, behaviour and life","Crooks, Robert L",150 CRO,166885,
Psychology: the science of behaviour,"Carlson, Neil R",150 CAR,166882,
Psychology: themes and variations,"Weiten, Wayne",150 WEI,193506,
Public administration,"Avasthi, Amreshwar",350 AVA,13396,
Public administration,"Simon, Herbert A",351 PUB,47300,
Public administration,"Avasthi, Amreshwar",351 AVA,176646,
Public administration and public affairs,"Henry, Nicholas",351 HEN,189995,
Public administration in India: an introduction,"Maheshwari, S. R.",351.54 MAH,199942,
"Public administration in India: tradition, trends and transformation","Arora, Ramesh K., ed.",351.54 PUB,254875,
Public administration in theory and practice,"Sharma, M. P",351.01 SHA,191684,
Public administration: a new paradigm,Ali Ashraf,351.54 ALI,132923,
Public administration: a reader,"Chakrabarty, Bidyut, ed.",351 PUB,254888,
"Public administration: a study in the theory... U. K., U. S. A. and India","Sharan, P",351 SHA,C12861,
Public administration: emerging perspectives,"Sahni, Pardeep",351.54 PUB,190094,
Public administration: principles and practice,"Tyagi, A. R",351 TYA,179338,
Public finance,"Hicks, Ursula K",336 HIC,37250,
Public finance in developing countries,"Prest, A. R",336.091724 PRE,61655,
Public finance in theory and practice,"Musgrave, Richard Abel",336.73 MUS,277284,
Public finance: a dynamic force in the economic system,"Narayan, B.N.",336 NAR,254879,
Public Finance: for honours and post graduate students of Indian Universities,"Bhatia, H. L",336 BHA,67165,
Public finance: in theory and practice,"Prest, A. R",336 PRE,61387,
Public finance: theory and practice,"Sundharam, K. P. M",336 SUN,188913,
Public health and social aspects,"Dutta, P. K.",363.1 DUT,179187,
Public International law,"Tandon, Mahesh Prasad",341 TAN,120770,
Public libraries in India: development and finance,"Thomas, V. K",027.40954 THO,176691,
Public library in India: impact on socio-cultural and educational of Mizoram,"Ngurtinkhuma, R.K.",027.454 NGU,298585,
"Public library legislation in the new millennium: new model public library acts for the union, states and union territories","Venkatappaiah, Velaga",027.4340954 VEK,316600,
Public library organization: with special reference to India,"Viswanathan, C. G",027.454 VIS,137792,
Public library systems: services and networking,"Ramaiah, L. S",027.4540285 PUB,175384,
Public participation in social defence,,361.954 SRI,75643,
public personnel administration: Theory and practice,"Goel, S.L.",351.01 GOE,206942,
"Public policy: formulation, implementation and evaluation","Sapru, R.K.",320.6 SAP,254882,
Public provisioning for elementary education in India,"Jha, Praveen",379.1120954 PUB,286114,
Public relations for your business,"Jefkins, Frank",659.2 JEF,168728,
Public relations: principles and practices,"Sachdeva, Iqbal S.",659.2 SAC,277460,
Public sector in India: a survey,"Dagli, Vadilal",330.954 PUB,16008,
"Pulse, digital and switching waveforms","Millman, Jacob",621.381537 MIL,285742,
Pump operation and maintenance,"Hicks, Tyler G",621.252 HIC,168333,
Pure solid geometry,"Bansi Lal, M. A",516.06 BAN,44716,
Quality of urban environment: a case study of Saharanpur city,Seemin Mushir,910.130760542 SEE,254852,
Quantitative analysis,"Day, R. A",545 DAY,284787,
"Quantitative aptitude: for competitive examanations, fully solved","Aggarwal, R. S",001.422 AGG,183663,
Quantitative techniques,"Kothari, C. R",001.422 KOT,200183,
Quantitative techniques,"Reddy,D. Obul",001.422 RED,200951,
Quantitative techniques for decision making,"Sharma, Anand",658.403 SHA,296799,
Quantitative techniques: for the MBA students of all Indian universities,"Satyadevi, C.",658.4033 SAT,260879,
Quantum challenge: modern research on the foundations of quantum mechanics,"Greenstein, George",530.12 GRE,284182,
Quantum chemistry,"McQuarrie, Donald A",541.28 MCQ,265734,
Quantum chemistry,"Levine, Ira N.",541.28 LEV,315282,
Quantum electrodynamics,"Greiner, Walter",537.67 GRE,284491,
Quantum field theory,"Ryder,Lewish H.",530.143 RYD,299280,
